[
  {
    "schema": "neec-summary-block/1.0",
    "key": "Status Quo Market Capitalism",
    "code": "SQ",
    "display_name": "Status Quo Market Capitalism",
    "record": {"documents": ["NEEC_Report_v1_6.md", "NEEC_Step1c_Retrofit_C1_2ab_C1_5.md"], "scored": "NEEC v1 (Report Part I), legacy 25-criterion structure; retrofitted to v2 in Session 8 (Step 1c)", "structure": "retrofit-step1c"},
    "scope": {"class": "configured_national_economy", "basis": "proposed"},
    "vector": {
      "C1.1": 0.5, "C1.2a": 0.5, "C1.2b": 0.0, "C1.3": 0.5, "C1.4": 0.0, "C1.5": 0.5,
      "C2.1": 0.5, "C2.2": 0.0, "C2.3": 0.5, "C2.4": 0.5, "C2.5": 0.5,
      "C3.1": 0.0, "C3.2": 1.0, "C3.3": 0.0, "C3.4": 0.5, "C3.5": 0.5,
      "C4.1": 0.0, "C4.2": 0.0, "C4.3": 0.5, "C4.4": 0.0, "C4.5": 0.0,
      "C5.1": 1.0, "C5.2": 1.0, "C5.3": 1.0, "C5.4": 0.5, "C5.5": 0.5
    },
    "summary": {"D1": 2.0, "D2": 2.0, "D3": 2.0, "D4": 0.5, "D5": 4.0, "total": 10.5, "failures": 9, "tier": "Structurally Inadequate"},
    "flags": [],
    "joint_readings": [
      {"id": "scored", "label": "as scored", "basis": "scored", "resolve": {}, "result": {"total": 10.5, "failures": 9, "tier": "Structurally Inadequate"}}
    ],
    "scenarios": []
  },
  {
    "schema": "neec-summary-block/1.0",
    "key": "Nordic Social Democracy",
    "code": "NSD",
    "display_name": "Nordic Social Democracy",
    "record": {"documents": ["NEEC_Report_v1_6.md", "NEEC_Step1c_Retrofit_C1_2ab_C1_5.md"], "scored": "NEEC v1 (Report Part I), legacy 25-criterion structure; retrofitted to v2 in Session 8 (Step 1c)", "structure": "retrofit-step1c"},
    "scope": {"class": "configured_national_economy", "basis": "proposed"},
    "vector": {
      "C1.1": 1.0, "C1.2a": 1.0, "C1.2b": 0.5, "C1.3": 1.0, "C1.4": 0.5, "C1.5": 1.0,
      "C2.1": 1.0, "C2.2": 0.5, "C2.3": 1.0, "C2.4": 1.0, "C2.5": 0.0,
      "C3.1": 1.0, "C3.2": 1.0, "C3.3": 0.5, "C3.4": 1.0, "C3.5": 0.0,
      "C4.1": 0.5, "C4.2": 0.5, "C4.3": 1.0, "C4.4": 1.0, "C4.5": 0.5,
      "C5.1": 1.0, "C5.2": 1.0, "C5.3": 0.5, "C5.4": 1.0, "C5.5": 0.5
    },
    "summary": {"D1": 5.0, "D2": 3.5, "D3": 3.5, "D4": 3.5, "D5": 4.0, "total": 19.5, "failures": 2, "tier": "Potentially Adequate"},
    "flags": [],
    "joint_readings": [
      {"id": "scored", "label": "as scored", "basis": "scored", "resolve": {}, "result": {"total": 19.5, "failures": 2, "tier": "Potentially Adequate"}}
    ],
    "scenarios": []
  },
  {
    "schema": "neec-summary-block/1.0",
    "key": "Centrally Planned Socialism",
    "code": "CPS",
    "display_name": "Centrally Planned Socialism",
    "record": {"documents": ["NEEC_Report_v1_6.md", "NEEC_Step1c_Retrofit_C1_2ab_C1_5.md"], "scored": "NEEC v1 (Report Part I), legacy 25-criterion structure; retrofitted to v2 in Session 8 (Step 1c)", "structure": "retrofit-step1c"},
    "scope": {"class": "configured_national_economy", "basis": "proposed"},
    "vector": {
      "C1.1": 1.0, "C1.2a": 0.0, "C1.2b": 0.5, "C1.3": 1.0, "C1.4": 0.5, "C1.5": 0.0,
      "C2.1": 0.0, "C2.2": 0.0, "C2.3": 0.0, "C2.4": 0.0, "C2.5": 0.5,
      "C3.1": 0.5, "C3.2": 1.0, "C3.3": 0.0, "C3.4": 0.0, "C3.5": 1.0,
      "C4.1": 0.5, "C4.2": 0.5, "C4.3": 1.0, "C4.4": 0.0, "C4.5": 1.0,
      "C5.1": 0.5, "C5.2": 0.0, "C5.3": 0.0, "C5.4": 0.0, "C5.5": 0.5
    },
    "summary": {"D1": 3.0, "D2": 0.5, "D3": 2.5, "D4": 3.0, "D5": 1.0, "total": 10.0, "failures": 12, "tier": "Structurally Inadequate"},
    "flags": [
      {"criterion": "C1.2b", "scored": 0.5, "alternatives": [1.0], "basis": "stated", "reading": "the formal wealth Gini, with no private capital markets", "tracks": null, "source": {"file": "NEEC_Step1c_Retrofit_C1_2ab_C1_5.md", "locator": "document", "phrase": "The case for 1.0."}}
    ],
    "joint_readings": [
      {"id": "scored", "label": "as scored", "basis": "scored", "resolve": {}, "result": {"total": 10.0, "failures": 12, "tier": "Structurally Inadequate"}},
      {"id": "up", "label": "every flagged call resolved upward", "basis": "extremes", "resolve": {"C1.2b": 1.0}, "result": {"total": 10.5, "failures": 12, "tier": "Structurally Inadequate"}},
      {"id": "down", "label": "every flagged call resolved downward", "basis": "extremes", "resolve": {}, "result": {"total": 10.0, "failures": 12, "tier": "Structurally Inadequate"}}
    ],
    "scenarios": []
  },
  {
    "schema": "neec-summary-block/1.0",
    "key": "Market Socialism",
    "code": "MS",
    "display_name": "Market Socialism",
    "record": {"documents": ["NEEC_Report_v1_6.md", "NEEC_Step1c_Retrofit_C1_2ab_C1_5.md"], "scored": "NEEC v1 (Report Part I), legacy 25-criterion structure; retrofitted to v2 in Session 8 (Step 1c)", "structure": "retrofit-step1c"},
    "scope": {"class": "comprehensive_system", "basis": "proposed"},
    "vector": {
      "C1.1": 1.0, "C1.2a": 1.0, "C1.2b": 0.5, "C1.3": 0.5, "C1.4": 0.5, "C1.5": 0.5,
      "C2.1": 1.0, "C2.2": 0.5, "C2.3": 1.0, "C2.4": 1.0, "C2.5": 0.0,
      "C3.1": 0.5, "C3.2": 0.5, "C3.3": 0.5, "C3.4": 1.0, "C3.5": 0.5,
      "C4.1": 0.5, "C4.2": 0.5, "C4.3": 0.5, "C4.4": 1.0, "C4.5": 0.5,
      "C5.1": 1.0, "C5.2": 0.5, "C5.3": 1.0, "C5.4": 0.5, "C5.5": 0.0
    },
    "summary": {"D1": 4.0, "D2": 3.5, "D3": 3.0, "D4": 3.0, "D5": 3.0, "total": 16.5, "failures": 2, "tier": "Potentially Adequate"},
    "flags": [],
    "joint_readings": [
      {"id": "scored", "label": "as scored", "basis": "scored", "resolve": {}, "result": {"total": 16.5, "failures": 2, "tier": "Potentially Adequate"}}
    ],
    "scenarios": []
  },
  {
    "schema": "neec-summary-block/1.0",
    "key": "Libertarian Minarchism",
    "code": "LM",
    "display_name": "Libertarian Minarchism",
    "record": {"documents": ["NEEC_Report_v1_6.md", "NEEC_Step1c_Retrofit_C1_2ab_C1_5.md"], "scored": "NEEC v1 (Report Part I), legacy 25-criterion structure; retrofitted to v2 in Session 8 (Step 1c)", "structure": "retrofit-step1c"},
    "scope": {"class": "comprehensive_system", "basis": "proposed"},
    "vector": {
      "C1.1": 0.0, "C1.2a": 0.0, "C1.2b": 0.0, "C1.3": 0.0, "C1.4": 0.0, "C1.5": 0.0,
      "C2.1": 0.0, "C2.2": 0.0, "C2.3": 1.0, "C2.4": 1.0, "C2.5": 1.0,
      "C3.1": 0.0, "C3.2": 0.5, "C3.3": 0.0, "C3.4": 0.0, "C3.5": 0.0,
      "C4.1": 0.0, "C4.2": 0.0, "C4.3": 0.0, "C4.4": 0.5, "C4.5": 1.0,
      "C5.1": 0.5, "C5.2": 1.0, "C5.3": 0.5, "C5.4": 0.5, "C5.5": 0.5
    },
    "summary": {"D1": 0.0, "D2": 3.0, "D3": 0.5, "D4": 1.5, "D5": 3.0, "total": 8.0, "failures": 15, "tier": "Structurally Inadequate"},
    "flags": [],
    "joint_readings": [
      {"id": "scored", "label": "as scored", "basis": "scored", "resolve": {}, "result": {"total": 8.0, "failures": 15, "tier": "Structurally Inadequate"}}
    ],
    "scenarios": []
  },
  {
    "schema": "neec-summary-block/1.0",
    "key": "MMT + Job Guarantee",
    "code": "MMT",
    "display_name": "MMT + Job Guarantee",
    "record": {"documents": ["NEEC_Report_v1_6.md", "NEEC_Step1c_Retrofit_C1_2ab_C1_5.md"], "scored": "NEEC v1 (Report Part I), legacy 25-criterion structure; retrofitted to v2 in Session 8 (Step 1c)", "structure": "retrofit-step1c"},
    "scope": {"class": "mechanism", "basis": "proposed"},
    "vector": {
      "C1.1": 1.0, "C1.2a": 0.5, "C1.2b": 0.0, "C1.3": 1.0, "C1.4": 0.5, "C1.5": 0.5,
      "C2.1": 0.5, "C2.2": 0.0, "C2.3": 0.5, "C2.4": 1.0, "C2.5": 0.5,
      "C3.1": 1.0, "C3.2": 0.5, "C3.3": 0.5, "C3.4": 1.0, "C3.5": 0.0,
      "C4.1": 0.5, "C4.2": 1.0, "C4.3": 1.0, "C4.4": 0.5, "C4.5": 0.5,
      "C5.1": 0.5, "C5.2": 1.0, "C5.3": 0.5, "C5.4": 0.5, "C5.5": 0.5
    },
    "summary": {"D1": 3.5, "D2": 2.5, "D3": 3.0, "D4": 3.5, "D5": 3.0, "total": 15.5, "failures": 3, "tier": "Partially Adequate"},
    "flags": [
      {"criterion": "C1.2b", "scored": 0.0, "alternatives": [0.5], "basis": "stated", "reading": "C4.4's reduction of capital power read as sufficient", "tracks": null, "source": {"file": "NEEC_Step1c_Retrofit_C1_2ab_C1_5.md", "locator": "document", "phrase": "override this call to 0.5"}}
    ],
    "joint_readings": [
      {"id": "scored", "label": "as scored", "basis": "scored", "resolve": {}, "result": {"total": 15.5, "failures": 3, "tier": "Partially Adequate"}},
      {"id": "up", "label": "every flagged call resolved upward", "basis": "extremes", "resolve": {"C1.2b": 0.5}, "result": {"total": 16.0, "failures": 2, "tier": "Potentially Adequate"}},
      {"id": "down", "label": "every flagged call resolved downward", "basis": "extremes", "resolve": {}, "result": {"total": 15.5, "failures": 3, "tier": "Partially Adequate"}}
    ],
    "scenarios": []
  },
  {
    "schema": "neec-summary-block/1.0",
    "key": "Universal Basic Income",
    "code": "UBI",
    "display_name": "Universal Basic Income",
    "record": {"documents": ["NEEC_Report_v1_6.md", "NEEC_Step1c_Retrofit_C1_2ab_C1_5.md"], "scored": "NEEC v1 (Report Part I), legacy 25-criterion structure; retrofitted to v2 in Session 8 (Step 1c)", "structure": "retrofit-step1c"},
    "scope": {"class": "mechanism", "basis": "proposed"},
    "vector": {
      "C1.1": 1.0, "C1.2a": 0.0, "C1.2b": 0.0, "C1.3": 0.5, "C1.4": 1.0, "C1.5": 0.0,
      "C2.1": 1.0, "C2.2": 1.0, "C2.3": 0.5, "C2.4": 0.5, "C2.5": 0.0,
      "C3.1": 1.0, "C3.2": 0.5, "C3.3": 0.5, "C3.4": 1.0, "C3.5": 0.0,
      "C4.1": 0.5, "C4.2": 0.5, "C4.3": 1.0, "C4.4": 0.0, "C4.5": 1.0,
      "C5.1": 1.0, "C5.2": 0.5, "C5.3": 1.0, "C5.4": 0.5, "C5.5": 0.0
    },
    "summary": {"D1": 2.5, "D2": 3.0, "D3": 3.0, "D4": 3.0, "D5": 3.0, "total": 14.5, "failures": 7, "tier": "Structurally Inadequate"},
    "flags": [],
    "joint_readings": [
      {"id": "scored", "label": "as scored", "basis": "scored", "resolve": {}, "result": {"total": 14.5, "failures": 7, "tier": "Structurally Inadequate"}}
    ],
    "scenarios": []
  },
  {
    "schema": "neec-summary-block/1.0",
    "key": "Degrowth Economics",
    "code": "DG",
    "display_name": "Degrowth Economics",